term_id	description	p_value	p_adjust	term_size	query_size	intersection_size	fold_enrichment
GO:0002323	natural killer cell activation involved in immune response	0.0028543120465014385	0.0028543120465014385	32	61	4	40.984
GO:0098586	cellular response to virus	0.0028543120465014385	0.0028543120465014385	78	61	5	21.017
GO:0042110	T cell activation	0.003754639664060486	0.003754639664060486	581	61	10	5.643
GO:0030101	natural killer cell activation	0.0041764535275756656	0.0041764535275756656	97	61	5	16.9
GO:0043330	response to exogenous dsRNA	0.004554966089749232	0.004554966089749232	51	61	4	25.715
GO:0045321	leukocyte activation	0.004554966089749232	0.004554966089749232	975	61	12	4.035
GO:0140888	interferon-mediated signaling pathway	0.004554966089749232	0.004554966089749232	111	61	5	14.769
GO:0007162	negative regulation of cell adhesion	0.004554966089749232	0.004554966089749232	287	61	7	7.997
GO:0043331	response to dsRNA	0.005251019132982825	0.005251019132982825	59	61	4	22.228
GO:0002694	regulation of leukocyte activation	0.006946381231618551	0.006946381231618551	572	61	9	5.159
GO:0065007	biological regulation	0.011179225251926826	0.011179225251926826	12804	61	51	1.306
GO:0071357	cellular response to type I interferon	0.011179225251926826	0.011179225251926826	86	61	4	15.25
GO:0046649	lymphocyte activation	0.011179225251926826	0.011179225251926826	811	61	10	4.043
GO:0060337	type I interferon-mediated signaling pathway	0.011179225251926826	0.011179225251926826	85	61	4	15.429
GO:1903037	regulation of leukocyte cell-cell adhesion	0.011179225251926826	0.011179225251926826	375	61	7	6.12
GO:0002696	positive regulation of leukocyte activation	0.011179225251926826	0.011179225251926826	363	61	7	6.323
GO:0050865	regulation of cell activation	0.011179225251926826	0.011179225251926826	627	61	9	4.706
GO:0001775	cell activation	0.011179225251926826	0.011179225251926826	1123	61	12	3.503
GO:0050867	positive regulation of cell activation	0.011179225251926826	0.011179225251926826	380	61	7	6.04
GO:0050863	regulation of T cell activation	0.01135857363964944	0.01135857363964944	386	61	7	5.946
GO:0034340	response to type I interferon	0.012861802791240719	0.012861802791240719	92	61	4	14.255
GO:0007159	leukocyte cell-cell adhesion	0.015582949068256078	0.015582949068256078	413	61	7	5.557
GO:0070664	negative regulation of leukocyte proliferation	0.015582949068256078	0.015582949068256078	99	61	4	13.247
GO:0032689	negative regulation of type II interferon production	0.017368925053385588	0.017368925053385588	41	61	3	23.99
GO:0002312	B cell activation involved in immune response	0.018634401165754537	0.018634401165754537	106	61	4	12.372
GO:0022408	negative regulation of cell-cell adhesion	0.018759312026207713	0.018759312026207713	197	61	5	8.322
GO:0032609	type II interferon production	0.02413358112386559	0.02413358112386559	119	61	4	11.021
GO:0042098	T cell proliferation	0.02413358112386559	0.02413358112386559	214	61	5	7.66
GO:0030155	regulation of cell adhesion	0.02413358112386559	0.02413358112386559	780	61	9	3.783
GO:0032649	regulation of type II interferon production	0.02413358112386559	0.02413358112386559	118	61	4	11.114
GO:0070661	leukocyte proliferation	0.026141864877976193	0.026141864877976193	339	61	6	5.803
GO:0002286	T cell activation involved in immune response	0.026442034580718376	0.026442034580718376	124	61	4	10.576
GO:0034097	response to cytokine	0.026532280390606528	0.026532280390606528	979	61	10	3.349
GO:0022407	regulation of cell-cell adhesion	0.02859818000654672	0.02859818000654672	493	61	7	4.655
GO:1901652	response to peptide	0.02859818000654672	0.02859818000654672	993	61	10	3.302
GO:0050868	negative regulation of T cell activation	0.02936593273622287	0.02936593273622287	132	61	4	9.935
GO:0048522	positive regulation of cellular process	0.02936593273622287	0.02936593273622287	5739	61	29	1.657
GO:0051249	regulation of lymphocyte activation	0.03072413745907071	0.03072413745907071	506	61	7	4.536
GO:0002823	negative regulation of adaptive immune response based on somatic recombination of immune receptors built from immunoglobulin superfamily domains	0.0329363441216448	0.0329363441216448	61	61	3	16.125
GO:0045348	positive regulation of MHC class II biosynthetic process	0.0329363441216448	0.0329363441216448	14	61	2	46.838
GO:0010812	negative regulation of cell-substrate adhesion	0.0329363441216448	0.0329363441216448	60	61	3	16.393
GO:1903038	negative regulation of leukocyte cell-cell adhesion	0.033712632605308254	0.033712632605308254	143	61	4	9.171
GO:0008285	negative regulation of cell population proliferation	0.033712632605308254	0.033712632605308254	686	61	8	3.824
GO:0050794	regulation of cellular process	0.034898213744566725	0.034898213744566725	11962	61	47	1.288
GO:0050870	positive regulation of T cell activation	0.034898213744566725	0.034898213744566725	255	61	5	6.429
GO:0046007	negative regulation of activated T cell proliferation	0.034898213744566725	0.034898213744566725	15	61	2	43.716
GO:0002820	negative regulation of adaptive immune response	0.036156309237981674	0.036156309237981674	66	61	3	14.903
GO:0050789	regulation of biological process	0.03757154948236508	0.03757154948236508	12397	61	48	1.269
GO:0071345	cellular response to cytokine stimulus	0.03805283672973345	0.03805283672973345	891	61	9	3.312
GO:0070663	regulation of leukocyte proliferation	0.04003063679624995	0.04003063679624995	269	61	5	6.094
GO:1903039	positive regulation of leukocyte cell-cell adhesion	0.04163608589047655	0.04163608589047655	276	61	5	5.94
GO:0019221	cytokine-mediated signaling pathway	0.04163608589047655	0.04163608589047655	564	61	7	4.069
GO:0008283	cell population proliferation	0.04163608589047655	0.04163608589047655	1961	61	14	2.341
GO:0045346	regulation of MHC class II biosynthetic process	0.04163608589047655	0.04163608589047655	18	61	2	36.43
GO:0051250	negative regulation of lymphocyte activation	0.042163985115815185	0.042163985115815185	164	61	4	7.997
GO:0009615	response to virus	0.042163985115815185	0.042163985115815185	416	61	6	4.729
GO:0042130	negative regulation of T cell proliferation	0.042163985115815185	0.042163985115815185	74	61	3	13.292
GO:0045342	MHC class II biosynthetic process	0.04294466971146469	0.04294466971146469	19	61	2	34.513
GO:0042113	B cell activation	0.04448625836820754	0.04448625836820754	286	61	5	5.732
GO:0032693	negative regulation of interleukin-10 production	0.046039532901582345	0.046039532901582345	20	61	2	32.787
GO:0002250	adaptive immune response	0.046175375469294594	0.046175375469294594	761	61	8	3.447
GO:0046651	lymphocyte proliferation	0.04773615240579111	0.04773615240579111	295	61	5	5.557
GO:0001818	negative regulation of cytokine production	0.04773615240579111	0.04773615240579111	295	61	5	5.557
GO:0032634	interleukin-5 production	0.04920473924736212	0.04920473924736212	22	61	2	29.806
GO:0032656	regulation of interleukin-13 production	0.04920473924736212	0.04920473924736212	22	61	2	29.806
GO:0032943	mononuclear cell proliferation	0.04920473924736212	0.04920473924736212	302	61	5	5.428
GO:0032674	regulation of interleukin-5 production	0.04920473924736212	0.04920473924736212	22	61	2	29.806
GO:0032616	interleukin-13 production	0.04920473924736212	0.04920473924736212	22	61	2	29.806
GO:0002366	leukocyte activation involved in immune response	0.04942885726843252	0.04942885726843252	304	61	5	5.393
GO:0042129	regulation of T cell proliferation	0.04942885726843252	0.04942885726843252	182	61	4	7.206
GO:0050896	response to stimulus	0.04942885726843252	0.04942885726843252	9051	61	38	1.377
GO:0002263	cell activation involved in immune response	0.04942885726843252	0.04942885726843252	308	61	5	5.323
GO:0048518	positive regulation of biological process	0.04942885726843252	0.04942885726843252	6150	61	29	1.546
GO:2000114	regulation of establishment of cell polarity	0.04942885726843252	0.04942885726843252	23	61	2	28.51
